85,Bottom hole temperature,Bottom-hole temperatures from water wells ,100,"Latitude, longitude, well identification information, depth/elevation, bottom-hole temperature, time lapsed since circulation stopped ",Wells with available BHT data  will be identified and a representative set of data will be selected for entry into a web-accessible database on a VA DMME server.  ,45,temp
86,"Digital well log, geothermal test wells ",Paper geophysical logs to be scanned,27,"Latitude, longitude, elevation, well identification information","For wells paper geophysical logs will be scanned.  For wells with digital logs available in-state but off-line, files will be acquired, verified, and quality-checked.  Files will be placed on publicly-accessible directory on VA DMME server.  A",45,lith
87,"Digital well log, water wells ",Paper geophysical logs to be scanned,100,"Latitude, longitude, elevation, well identification information","For wells paper geophysical logs will be scanned.  For wells with digital logs available in-state but off-line, files will be acquired, verified, and quality-checked.   Representative wells from around the state will be selected.  ",45,lith
88,Document,"Various published and unpublished reports emanating from geothermal research at Virginia Tech, 1969-1989",30,"Title, authors, year, reference information, page numbers, total number of pages, file size",Bibliography of published and unpublished documents related to geothermal energy in the state will be developed and placed on VA DMME server.  ,45,meta
89,Geologic map,"Georgia geologic atlas series, paper maps",7,"Title, authors, year, scale, reference information, total number of pages (if report accompanies map), file size","USGS national geologic map database will be checked.  Team will seek permission from state geological survey to place their geological maps online for free download.  Where permission is granted, existing scanned 1:24,000 geologic maps and their accompanying reports will be converted to .pdf and made available for free download on VA DMME server.  ",45,map
90,"Geologic Unit feature,  geothermal characterization",Descriptions of geologic units mapped in the state,300,"Rock unit name, major lithologies, thermal conductivity","Geologic rock units used on geologic maps in the state will be described and characterized, including thermal conductivity data, where available.  Records will be stored in web-accessible database on VA DMME* server.  ",45,meta
91,Heat flow measurement ,"",TBD,"Latitude, longitude, well identification information, depth/elevation, measured heat flow",For wells heat flow measurements will be entered in web-accessible database on VA DMME server.  ,45,temp
92,Hot spring description,Springs with higher-than-background water temperature,7,"Latitude, longitude, flow rate, water temperature, water chemistry (if available)",Descriptions of thermal spring in the state from published and unpublished reports.  unavailable data will be stored in web-accessible database on VA DMME server.  ,45,temp
93,Temperature depth log ,Temperature logs from geothermal test wells,27,"Latitude, longitude, well identification information, depth/elevation, temperature ",For wells temperature/depth measurements will be entered in web-accessible database on VA DMME server.  Metadata will be developed for all records and entered into NGDS.,45,lith
94,Thermal conductivity measurement ,Thermal conductivity of rocks tested by Virginia Tech,TBD,"Latitude, longitude, sample identification information, depth/elevation of sample, measured thermal conductivity, measurement procedure","For wells currently unavailable through other sources (e.g., SMU), thermal conductivity measurements will be gleaned from published and unpublished reports.  Data will be stored in web-accessible database on VA DMME server.  Metadata will be developed for all records and entered into NGDS.",45,temp
95,Geologic map,polygon count for map,1,Polygons in shapefile,"Polygons in shapefile to repository, also serve as WFS from regional hub; WMS from regional hub with standard unit type portrayal and age portrayal.",1,map
96,Hot springs,Ho tsprings features (content model),<50,point shape file for service,"Hot spring feature wfs, provide point shape file for service",1,temp
97,Metadata,"technical reports, engineering reports, studies of Hawaii's geothermal system",estimated 350,one metadata record for each document,create metadata records in table form or xml file for import into NGDS catalog server. Documents will be scanned and placed in web-accessible location; URLs will be in metadata.,1,meta
98,Metadata,Cored intervals,1000,1000 records,"create ISO19139 xml document for each core interval,  submit for insert into metadata catalog.",1,meta
99,Metadata,well cuttings sample,2000,2000 records,"create ISO19139 xml document for each sample interval,  submit for insert into metadata catalog.",1,meta
100,Temperature observation,BHT well data,1000,1000 records,deliver as observation features via WFS.,1,temp
101,Volcanic rift systems,Rift zone shape files,20,polygon count for map,Rift zone outlines  delivered in shape files to regional hub for serving as WFS; shape file will also be put in document repository.,1,map
102,Water chemistry observation,observations,1000,1000 records,deliver as observation features via WFS.,1,wchem
103,Bedrock Geologic map,bedrock geology map,3501,"3,501 polygon features","WFS via ArcGIS Server, will require information for configuration (attributes to expose, etc.) from NGDC staff, testing assistance.",14,map
104,Bedrock Surface Elevation (vector format 50-ft. contour interval),bedrock surface elevation map,1,polyline features (165MB),"WFS via ArcGIS Server, will require information for configuration (attributes to expose, etc.) from NGDC staff, testing assistance.",14,map
105,Bedrock Surface Elevation (interpolated raster),bedrock surface elevation map,1,"coverage (raster, img format, 69MB, including 5MB pyramid file)","WMS via ArcGIS Server, will require information for configuration (attributes to expose, etc.) from NGDC staff, testing assistance.",14,map
106,Geologic Sampling Points. ,Sample data and lat/long point file,60000,"60,000+ point features","WFS via ArcGIS Server (preferred), will require information for configuration (attributes to expose, etc.) from NGDC staff, testing assistance; file-based to NGDC data center (alt.)",14,map
107,Bedrock depth (Quaternary isopach - interpolated raster coverage),depth to bedrock map,1,"coverage (raster, img format, 66MB)","WMS via ArcGIS Server, will require information for configuration (attributes to expose, etc.) from NGDC staff, testing assistance (preferred); file-based delivery in preferred format to NGDC data center (alt.).",14,map
108,Bedrock depth (Quaternary isopach - vector format 50-ft. contour interval),depth to bedrock map,1,polyline features (165MB),"WFS via ArcGIS Server (preferred), will require information for configuration (attributes to expose, etc.) from NGDC staff, testing assistance; file-based to NGDC data center (alt.)",14,map
109,Geothermal system features,Representing facilities with geothermal heating/cooling installation. Geothermal heating/cooling installations compiled from several sources,"8,000 point features ","location, attributes","WFS via ArcGIS Server (preferred), will require information for configuration (attributes to expose, etc.) from NGDC staff, testing assistance; file-based to NGDC data center (alt.)",14,lith
110,Resource Suitability Map ,coverage and/or features,1,"Mapping will incorporate geologic, hdyrogeologic, and other characteristics to determine suitably for various types of geothermal heating/cooling installations. ","Development of a prototype beginning this year that will incorporate one to four counties. WFS/WMS via ArcGIS Server (preferred), will require information for configuration from NGDC staff, testing assistance; ",14,map
111,Active Fault,IGS interactive fault map, 250 Quaternary and younger mapped faults,The IGS interactive fault map has more than 250 Quaternary and younger mapped faults; these will be reviewed and compared with the USGS fault database to avoid duplication with that data set and to identify fault information that is more recent / accurate,Data will be converted from the existing IGS fault database; records that duplicate USGS data will be flagged; and the data will be provided in ESRI shapefile format,9,tect
112,Document,"metadata records of the most relevant reports converted to pdf format, and pdf files in repository",200,metadata,Documents will be scanned into pdf format; a spreadsheet index will be created to facilitate search and retrieval of the document files,9,meta
113,Document,thermal water source descriptions,1000,"name, location, temperature","Data table will be converted to an ESRI shapefile and linked to the bibliographic index, above",9,meta
114,Document,"document in repository, and metadata for document",1,metadata,A spreadsheet index ,9,meta
115,Digital well log,metadata records for wells. ,50,"Data for BHT, chemistry, flow rates in separate tables where available.","A spreadsheet index will be created to facilitate locating and retrieving the IGS holdings.  Where feasible, relevant documents (drillers' reports, well logs, etc.) will be converted to pdf format ",9,lith
116,Digital well log,"Idaho Dept. of Water Resources 1000 geothermal wells, plus capture of well information for at least 200 deepest and hottest wells Reports and paper / microfiche logs of geothermal wells at the Idaho Dept. of Water Resources catalogued. ",1000," The amount is  unknown, so in Phase I  quantify how material will be captured in Phase II and III.", A spreadsheet index will be created as metadata for retrieval of  information in IDWR's holdings.  Some documents will be converted to pdf format .  The data will be made available to IDWR to offer online in the manner they choose or as a WFS.   ,9,lith
117,Chemical analysis (whole-rock chemistry),"ca.500 whole-rock analyses of U-Th-K contents, that only exists in NURE paper records . Tabular data on U-Th-K abundances in igneous and volcanic rocks from the NURE (National Uranium Resource Evaluation) program in the Challis 1x2 degree sheet",500,"Compare published digital data from U-Th-K sample locations in the NAVDAT (Western N. American Volcanic and Intrusive Rock) database with NURE whole-rock data to evaluate (a) the quality of the NURE data, and (b) whether further capture of NURE data in th","Paper data tables will be scanned and provided in pdf format  (by Phase 3, all data tables will be in shapefile format).  Metadata including data provenance, contact information, and data quality descriptors will be provided",9,rchem
118,Temperature depth log,Temperature vs. Depth well log for oil well ,appx. 30,"Surface location, depth and temperature at depth  time since circulation, hole diameter. ","Digitize logs, incorporate into geo thermal map  and make available as LAS files",27,lith
119,Bottom hole temperature,Oil well log bottom hole temperture reading from log header,5000,"Surface location, bottom hole temperature, bottom hole depth. ","Plan to make an x,y,z,z spreadshet in EXCEL showing Latitude, Longitude, Depth, temperature for entire state.  Start the sampling rate at 1 well per section.",27,temp
120,Drill stem test,Drill Stem test,2500,"surface location, depth interval tested, well bore pressures, fluid recoveries ","Input data into EXCEL, eventually into ORACLE  and upload on project database.",27,temp
121,Bottom hole temperature,"Bottom-hole temperatures, derived from petroleum logs of the Indiana Geological Survey.",2000,"Temperature, depth, borehole identification number, collar elevation, latitude and longitude of collar, source, date measured, settling interval, hole diameter, procedure.",Data will be provided in an ESRI shapefile for NGDS document repository. Metadata that is compliant with standards of the Federal Geographic Data Committee (FGDC) will be provided as TXT files.,22,temp
122,Temperature ,"Temperature logs, derived from the files of the Indiana Geological Survey.", 150 points ,"Temperature, depth, boreholeID, collar elevation, latitude and longitude of collar, source, date measured, settling interval, hole diameter, procedure.",Data will be provided in an ESRI shapefile for NGDS document repository. Metadata that is compliant with standards of the Federal Geographic Data Committee (FGDC) will be provided as TXT files.,22,temp
123,Geologic map,"Bedrock geology (1:24,000), derived from a series of published geologic maps. Products of the National Cooperative Geologic Mapping Program, showing bedrock geology of selected quadrangles.",5 maps will be scanned and georeferenced.,"Maps provide names of geologic formations, groups, and other geologic units in selected quadrangles, counties, and other subareas of Indiana. Generalized characterization of rock types associated with the rock units.",Maps will be provided as georeferenced raster images for NGDS document repository. Metadata that is compliant with standards of the Federal Geographic Data Committee (FGDC) will be provided as TXT files.  ,22,map
124,Geologic map,"Maps of Indiana showing structure on top of selected stratigraphic units. Indiana Geological Survey, Department of Energy Maps 810, 811, 812, 813, and 814.",5 maps will be scanned and georeferenced.,"Elevations on tops of the New Albany Shale (Devonian and Mississippian), Silurian strata, Maquoketa Group (Ordovician), Trenton Limestone (Ordovician), Knox Dolomite (Ordovician and Cambrian), Mt. Simon Sandstone (Cambrian), and Precambrian basement.",Maps will be provided as georeferenced raster images for NGDS document repository. Metadata that is compliant with standards of the Federal Geographic Data Committee (FGDC) will be provided as TXT files.  ,22,map
125,Geologic map,Catalog of core samples that are contained in the core library of the Indiana Geological Survey.," 1,000 boreholes ","Location, unique identification number, and total depth of borehole.",Maps will be provided as georeferenced raster images for NGDS document repository. Metadata that is compliant with standards of the Federal Geographic Data Committee (FGDC) will be provided as TXT files.  ,22,map
126,Geologic map,Catalog of well samples that are contained in the archives of the Indiana Geological Survey.," 13,000 wells ","Location, unique identification number, and sample interval.",Maps will be provided as georeferenced raster images for NGDS document repository. Metadata that is compliant with standards of the Federal Geographic Data Committee (FGDC) will be provided as TXT files.  ,22,map
127,Geologic map,Index maps for petroleum logs,6,Index to petroleum logs in the archives of the Indiana Geological Survey. Amount = 716 Kilobytes,Maps will be provided as georeferenced raster images for NGDS document repository. Metadata that is compliant with standards of the Federal Geographic Data Committee (FGDC) will be provided as TXT files.  ,22,map
128,Geologic map,bedrock geology map,1,"Bedrock geology (1:500,000), derived from a published geologic map. Amount = 1.2 Megabytes",Maps will be provided as georeferenced raster images for NGDS document repository. Metadata that is compliant with standards of the Federal Geographic Data Committee (FGDC) will be provided as TXT files.  ,22,map
129,Geologic map,depth to bedrock map,1,"Depth to bedrock, derived from drilling logs in the files of the Indiana Geological Survey and water-well logs in the files of the Indiana Department of Natural Resources. Amount = 11.7 Megabytes",Maps will be provided as georeferenced raster images for NGDS document repository. Metadata that is compliant with standards of the Federal Geographic Data Committee (FGDC) will be provided as TXT files.  ,22,map
130,Geologic map,bedrock elevation map,1,"Elevation of bedrock, derived from drilling logs in the files of the Indiana Geological Survey and water-well logs in the files of the Indiana Department of Natural Resources. Amount = 31.3 Megabytes",Maps will be provided as georeferenced raster images for NGDS document repository. Metadata that is compliant with standards of the Federal Geographic Data Committee (FGDC) will be provided as TXT files.  ,22,map
131,Geologic map,seismic depth to bedrock map data,1,Index to seismic shot information that has been used to determine the depth to bedrock and to infer the lithology of the bedrock. Amount = 602 Kilobytes,Maps will be provided as georeferenced raster images for NGDS document repository. Metadata that is compliant with standards of the Federal Geographic Data Committee (FGDC) will be provided as TXT files.  ,22,map
132,Geologic map,Drainage classifications and other soil characteristics map,1,"Drainage classifications and other soil characteristics, derived from the SSURGO database of the U.S. Department of Agriculture. Amount = 87.9 Megabytes",Maps will be provided as georeferenced raster images for NGDS document repository. Metadata that is compliant with standards of the Federal Geographic Data Committee (FGDC) will be provided as TXT files.  ,22,map
133,Borehole geophysical data,Index maps for gamma logs,1,Index to natural gamma-ray logs that were collected by the Indiana Geological Survey between 1978 and 2005. Amount = 206 Kilobytes,Maps will be provided as georeferenced raster images for NGDS document repository. Metadata that is compliant with standards of the Federal Geographic Data Committee (FGDC) will be provided as TXT files.  ,22,map
134,Water source feature,Coal mine extent map data ,1,"Extents of flooded underground coal mines, derived from the Coal Mine Information System of the Indiana Geological Survey. Amount = 5.4 Megabytes",Maps will be provided as georeferenced raster images for NGDS document repository. Metadata that is compliant with standards of the Federal Geographic Data Committee (FGDC) will be provided as TXT files.  ,22,map
135,Water source feature,Database for quarries,1,Database of abandoned industrial mineral quarries in Indiana (1994). Amount = 65 Kilobytes,Maps will be provided as georeferenced raster images for NGDS document repository. Metadata that is compliant with standards of the Federal Geographic Data Committee (FGDC) will be provided as TXT files.  ,22,map
136,Permeability,"Aquifer tansmissivity values in five major Indiana drainage basins, estimated by the Indiana Department of Natural Resources (IDNR)."," 4,800 water-well logs ","Well identification number, aquifer transmissivity values.",Data will be provided in an ESRI shapefile for NGDS document repository. Metadata that is compliant with standards of the Federal Geographic Data Committee (FGDC) will be provided as TXT files.,22,Other
137,Water chemistry,"Chemistry of waters associated with flooded underground coal mines and surrounding unmined coalbeds, derived from published and unpublished reports and student theses.", 280 points ,"Identification number, source, type, associated mine, coalbed (s), number of samples, total dissolved solids, specific conductance, pH, acidity, alkalinity, sulfate, sodium, fluoride, chloride, calcium, magnesium, iron, managanese, aluminum.",Maps will be provided as georeferenced raster images for NGDS document repository. Metadata that is compliant with standards of the Federal Geographic Data Committee (FGDC) will be provided as TXT files.  ,22,map
138,Water chemistry,"One published report will be scanned.. Assessment of the 3,000 ppm and 10,000 ppm total dissolved solids boundaries in the Mississippian and Pennsylvanian aquifers of southwestern Indiana. Indiana Geological Survey, Open-File Study 94-02",1,"Boundaries of  3,000 ppm and 10,000 ppm total dissolved solids  in Mississippian and Pennsylvanian aquifers.",Report will be provided in a PDF file format for NGDS document repository.,22,map
139,Bottom hole temperature,Bottom hole temperature,"60,450 records","location, type of hole, depth of measurement","The data delivery plan for the BHT, Digital Well Log, and Drill Stem Test Data, will be the same for each dataset:  Data will be provided as web-based mapping services in ArcGIS Server's native format for direct integration into ESRI software, as well as the Open Geospatial Consortium's (OGC) Web Map Service (WMS) and Web Feature Service (WFS) formats. A RESTful web service will be created to return the metadata in XML format.  Additionally, data will be made available for download in ESRI Shapefile and File Geodatabase format from the KGS web site.",34,temp
140,Bottom hole temperature,Bottom hole temperature,"95,102 records","location, type of hole, depth of measurement","Data will be provided as web-based mapping services in ArcGIS Server's native format for direct integration into ESRI software, as well as the Open Geospatial Consortium's (OGC) Web Map Service (WMS) and Web Feature Service (WFS) formats. A RESTful web service will be created to return the metadata in XML format.  Additionally, data will be made available for download in ESRI Shapefile and File Geodatabase format from the KGS web site.",34,temp
141,Digital well log,Digital well log,"4,175 records","location, type of E-log, LAS file","Data will be provided as web-based mapping services in ArcGIS Server's native format for direct integration into ESRI software, as well as the Open Geospatial Consortium's (OGC) Web Map Service (WMS) and Web Feature Service (WFS) formats. A RESTful web service will be created to return the metadata in XML format.  Additionally, data will be made available for download in ESRI Shapefile and File Geodatabase format from the KGS web site.",34,lith
142,Digital well log,Digital well log,"90,195 records","location, type of E-log, scanned E-log (TIF format)","Data will be provided as web-based mapping services in ArcGIS Server's native format for direct integration into ESRI software, as well as the Open Geospatial Consortium's (OGC) Web Map Service (WMS) and Web Feature Service (WFS) formats. A RESTful web service will be created to return the metadata in XML format.  Additionally, data will be made available for download in ESRI Shapefile and File Geodatabase format from the KGS web site.",34,lith
143,Drill stem test,Drill stem test,"2,170 digital DST records","location, zones studied","Data will be provided as web-based mapping services in ArcGIS Server's native format for direct integration into ESRI software, as well as the Open Geospatial Consortium's (OGC) Web Map Service (WMS) and Web Feature Service (WFS) formats. A RESTful web service will be created to return the metadata in XML format.  Additionally, data will be made available for download in ESRI Shapefile and File Geodatabase format from the KGS web site.",34,temp
144,Drill stem test,Drill stem test,"4,146 scanned DST reports","location, zones studied","Data will be provided as web-based mapping services in ArcGIS Server's native format for direct integration into ESRI software, as well as the Open Geospatial Consortium's (OGC) Web Map Service (WMS) and Web Feature Service (WFS) formats. A RESTful web service will be created to return the metadata in XML format.  Additionally, data will be made available for download in ESRI Shapefile and File Geodatabase format from the KGS web site.",34,temp
145,Geologic map,"surficial geology (polygon), contacts (lines), and marker beds, if available (lines).  ",23 county maps ,map in seamless geodatabase format ,"Database items include - surficial geology (map unit and map unit abbreviation), contacts (map unit, map unit abbreviation), marker beds (left/right map unit name) ",34,map
146,Geothermal map,"Update of the Geothermal Gradient Map of Kansas (Stavnes and Steeples, Kansas Geological Survey, 1982).",1,"","Data will be provided as web-based mapping services in ArcGIS Server's native format for direct integration into ESRI software, and OGC WMS and WFS formats.  Additionally, the geodatabase files will be made available for download via the KGS web site.  FGDC-compliant metadata will also be developed for the database.",34,meta
147,Temperature Log image (Document),"14,000 images","14,000","Lat, Long, Operator, Farm, Well Number, API # (if known), total depth",Catalog of images to be provided in appropriate format for NGDS repository. TIFF images will be on existing KGS server.,33,lith
148,Temperature Depth Log (Coverage),digital observations from borehole temperature logs,450,"Lat, Long, Operator, Farm, Well Number, API # (if known), total depth, temperature measurements",Catalog of LAS formatted files for NGDS repository with LAS files hosted on KGS server.,33,lith
149,Digital Well Log (Coverage),Various curves from borehole geophysical logs,450,"Lat, Long, Operator, Farm, Well Number, API # (if known), total depth, distinct curve measurements",Catalog of LAS formatted files for NGDS repository with LAS files hosted on KGS server.,33,lith
150,Bottom Hole temperature (Observation),reported temperatures from boreholes,3000,"Lat, Long, Operator, Farm, Well Number, API # (if known), total depth, reported bottom hole temperatures, Time Since Circulation, borehole properties",Data in appropriate format in NGDS repository,33,lith
151,Bottom Hole Temperature/Drillstem Test Data,"Petroleum Wells data from Geopresured sections, (will be collected)",2500 records (approx),"Sec-TWP-RNG, WellID, Depth, Temp & Pressure Data from varoius depths (up to six zones per well record), bit size,",Data will be provided in an excel spreadsheet document for NGDS repository; arrangement with NGDS core to incorporate data into database for NGDS borehole temperature WFS service. Pressure data for geopressured zones wll  included as a separate item after consultation with NGDS.,48,temp
