305,Borehole data,borehole data record,?,"Well ID, location, date, well log lithology, geo chem, temp logs, temp gradient, U/Th",Excel (?) spreadsheet,46,temp
306,Document metadata,metadata record for document,?,"","format tbd, content conforms to NGDS requirements.",46,meta
307,Bottom Hole Temperature - data,BHT records,?,BHT content model for NGDS,spreadsheet or shape file,46,temp
308,Temperature,Bottom hole temperatures dataset. Temperatures are in Fahrenheit in wells and O&G tests,1906 wells/test holes,"location, API no. Well name, Final BHT in F, max temp, BHT with associated data source, depth ",Data will be provided in an excel spreadsheet document for NGDS repository,6,temp
309,Geologic map,A map of calculated geothermal gradients (using the bottom hole temperature table) that are hand-contoured at 1 oF/100 ft intervals,1 map,The bottom hole temperature data table listed above. 1 map and associated geospatial files,The map will be compiled in ArcInfo. Files can be provided either in a geodatabase or in shapefiles.,6,map
310,Document,document describing an 880 meter core hole on the DOE Oak Ridge National Laboratory drilled in 1961.  Approximately 150 thermal conductivity measurements  A heat flow value for the borehole was determined.,1,Metadata content recommended for documents for NGDS metadata,create metadata records in table form or xml file for import into NGDS catalog server. Work out details with project management.,40,meta
311,Document,Geothermal Installation Reports from residential and commercial sites,90-300,"location, depth, elevation, date drilled, geothermal test results;bedrock formation(s) and lithology ","digitize (scan) the company geothermal installation reports in a PDF format.  Summarize the attributes associated with each site (metadata) in an Excel spreadsheet (.cvs format) designed for direct uploading into the NGDS core catalog.  we plan to scan them using OCR. Submit to  NGDS data center (e.g., Kentucky).",40,meta
312,Thermal Conductivity Measurement; Tennessee Valley Authority geothermal test site reports,"metadata for borehole, thermal conductivity measurement",65,"borehole location, depth, elevation, date drilled, thermal conductivity test results; bedrock formation(s) and associated lithology ","Provide scans in PDF format of the TVA geothermal installation test site reports.  Summarize the attributes associated with each site (metadata) in an Excel spreadsheet (.cvs format) 
Tennessee Division of Geology does not have the resources to implement a web service for data delivery.  NGDS data center (e.g., Kentucky).",40,temp
313,Temperature Depth Log,Oil and Gas Log,1200,"borehole location (lat/long), depth, elevation, date drilled, BHT if known.","Digitize (scan) the temperature depth log for each oil and gas well (.tif or .pdf formats).  We plan to compile the metadata in an Excel spreadsheet  (.cvs format) Tennessee Division of Geology does not have the resources to implement a web service for data delivery.  NGDS data center (e.g., Kentucky).  ",40,lith
314,Digital well log,"We have electronically scanned 43,173 records of the 327,701 available and extracted 2,661 data points  having BHT data.","327,701 cataloged well records","geographic location, depth, formation properties interpretable from geophysical log response",active link to small test data set will be constructed and tested within months 1 to 2 following statement of work plan approval and signing of subcontract.,41,lith
315,Digital well log,To be determined based on small data set test,"","geographic location, depth, formation properties interpretable from geophysical log response","Following successful completion of small test data set, month 3-12 will include the linkage to as many of the remaining digital logs as possible.",41,lith
316,Borehole lithology log dataset,"The core warehouse holds approximately 1 to 2 million linear feet of core, but this core is not specifically tied to well logs in the RRC or IGOR database sets.  Further, there is no clear way to sort the records by region, such that those logs available ",To be determined based on small data set test,"geographic location, depth, formation properties interpretable from geophysical log response","The actual number of well logs to be contributed will depend on the small data set test.  However, it is possible that up to 300 well logs per month will be scanned during the initial year of the project.  Months 1 to 3 will identify those critical areas, and wells that are deemed most important to scan.  Months 2 through 12 will include scanning and linking up to 300 logs each month for a total of 3,000 for the year.",41,lith
317,Document,"Review of data records has found 19,000 cataloged documents; however, only a very limited number of these documents are related to geothermal energy and a smaller subset is related to the West Texas Area.  Of this limited subset, initial examination found","TBD. Review of available records indicates  15,000 documents ","descriptions, data, analysis, consolidation of information, graphic illustration of resources.",Initial assessment is under way now.  Documents will be divided into those that are relevant to geothermal information and those that are secondary.  Primary documents will then be scanned at a rate to ensure that all relevant documents are completed prior to project completion,41,meta
318,Active Faults  (Quaternary faults),Active fault feature dataset,200 individual line features,200 individual line features (> 2000 attribute records),service and file based repository.  Single geospatial vector data layer available for download in shp file format from both UGS and Utah's AGRC GIS repository (http://geology.utah.gov/geothermal/ http://gis.utah.gov/download).  Data also to be available through Utah's State Geographic Information Database (SGID) as a feature data set through ArcSDE service (gdb93.agrc.utah.gov).,24,tect
319,Document  (Quaternary Faults),"Scanned report with about 200 individual Quaternary faults, fault segments, and folds in Utah.",1 report,"",Scanned pdf document to be available for download from UGS document repository (http://geology.utah.gov/geothermal/).  Future plans may include extracting tabular data records for integration with GIS spatial dataset.,24,meta
320,Volcanic Vents Feature  (Quaternary volcanic rocks),volcanic sources and flows ,130-150 ,Sservice and file based repository. Inlcuding about 130-150 volcanic sources and flows with eruption dated during the Quaternary period,  Single geospatial vector data layer available for download in shp file format from both UGS and Utah's AGRC GIS repository (http://geology.utah.gov/geothermal/ http://gis.utah.gov/download).  Data also to be available through Utah's State Geographic Information Database (SGID) as a feature data set through ArcSDE service (gdb93.agrc.utah.gov).,24,map
321,Document  (Volcanic Rocks & Vents),"Scanned report with data pertaining to Quaternary volcanic rocks in Utah (feature name, location, age, composition, etc.)",1 report,Document metadata,Scanned pdf and Excel Spreadsheet document available for download from UGS document repository (http://geology.utah.gov/geothermal/).  Future plans may include extracting tabular data records for integration with GIS spatial dataset.,24,meta
322,Hot spring descriptions,Spreadsheet document; accompanying text where appropriate,290,Data pertaining to about 290 thermal springs (temp. > 20 C) in Utah," to be compiled from existing documents and data sets, and provided through a web feature serivce (metadata, URL).",24,temp
323,Thermal well descriptions,Spreadsheet document; accompanying text where appropriate,850,Data pertaining to about 850 thermal wells (temp. > 20 C) in Utah,"Spreadsheet document; accompanying text where appropriate; to be provided through a web feature serivce (metadata, URL).",24,temp
324,Temperature-depth logs,Boreholes with temperature-depth data to augment SMU dataset for Utah,175 temperature profiles,"","Additional temperature-depth data in spreadsheet format plus scanned lithologic logs (where available); to be provided through a web feature service (metadata, URL)",24,temp
325,Geologic maps,Geologic maps at 1:500k; 1:250k; 1:100k ; 1:24k,25,"1:100,000-scale geologic maps (25 of the 46 total covering State of Utah)",Available in both service and file based repository.  Single geospatial vector data layer available for download in shp file format from both UGS and Utah's AGRC GIS repository (http://geology.utah.gov/maps/geomap/30x60/index.htmhttp://gis.utah.gov/download).  Data also to be available through Utah's State Geographic Information Database (SGID) as a feature data set through ArcSDE service (gdb93.agrc.utah.gov).  And through their ESRI raster image service (image.agrc.utah.gov),24,map
326,Drill stem tests,"Drill-stem tests from oil & gas fields (Uinta Basin, Paradox Basin, Overthrust Belt) from IHS database for Utah.",about 150,"",DST data to be provided initially in document format (available through URL with metadata); 150 DSTs represents first year contribution out of 500 total DSTs.,24,wchem
327,Bottom-hole temperatures (oil/gas exploratory wells),"BHT data from selected, oil/gas wells from UDOGM scanned geophysical logs",about 100 in year one,"","Corrected BHTs and accompanying parameters (borehole diameter, time since drill fluid circulation, depth, location, elevation, etc) provided initially as preliminary PDF report(s) in year one, then eventually through a web feature service (metadata, URL).",24,temp
328,Document (searchable bibliography),"Searchable, annotated geothermal bibliography for Utah",1,"","Spreadsheet document; accompanying text; to be compiled from existing documents and data sets, and provided through a web feature serivce (metadata, URL).  Links also available through the USGIN catalog at http://mw.usgin.org.",24,meta
329,"Borehole lithology logs, geothermal test wells",Lithologic descriptions of cuttings or core by depth interval,50,"Latitude, longitude, elevation, well identification information, completion date, depth intervals, lithology for interval","For wells, interval lithology descriptions will be entered in web-accessible database on VA DMME server.  ",35,lith
330,"Borehole lithology logs, water wells",Lithologic descriptions of cuttings or core by depth interval,200,"Latitude, longitude, elevation, well identification information, completion date, depth intervals, lithology for interval","For wells, interval lithology descriptions will be entered in web-accessible database on VA DMME server. ",35,lith
331,"Borehole lithology logs, oil and gas wells",Lithologic descriptions of cuttings or core by depth interval,200,"Latitude, longitude, elevation, well identification information, completion date, depth intervals, lithology for interval","For wells, interval lithology descriptions will be entered in web-accessible database on VA DMME server. ",35,lith
332,"Digital well log, geothermal test wells ",Paper geophysical logs to be scanned,50,"Latitude, longitude, elevation, well identification information","For wells, paper geophysical logs will be scanned.  For wells with digital logs available in-state but off-line, Files will be placed on publicly-accessible directory on VA DMME server.  A",35,meta
333,"Digital well log, water wells ",Paper geophysical logs to be scanned,100,"Latitude, longitude, elevation, well identification information","For wells, paper geophysical logs will be scanned.  For wells with digital logs available in-state but off-line, files will be acquired, verified, and quality-checked.   Representative wells will be selected.  Files will be placed on publicly-accessible directory on VA DMME server.  ",35,meta
334,"Digital well log, oil and gas wells ",Paper geophysical logs to be scanned,200,"Latitude, longitude, elevation, well identification information","For wells, paper geophysical logs will be scanned.  For wells with digital logs available in-state but off-line, files will be acquired, verified, and quality-checked.   Representative wellswill be selected.  Files will be placed on publicly-accessible directory on VA DMME server.  A",35,meta
335,Temperature depth log ,Temperature logs from geothermal test wells,100,"Latitude, longitude, well identification information, depth/elevation, temperature ","For wells, temperature/depth measurements will be entered in web-accessible database on VA DMME server.  M",35,lith
336,Document,"Various published and unpublished reports emanating from geothermal research at Virginia Tech, 1969-1989",30,"Title, authors, year, reference information, page numbers, total number of pages, file size","Bibliography of published and unpublished documents related to geothermal energywill be developed and placed on VA DMME server.  Each non-copyrighted report that is presently unavailable online will be scanned and processed with optical character recognition software, converted to portable document file format (.pdf), then made available for free download on VA DMME server.  ",35,meta
337,Geologic map,"175 scanned 1:24,000 geologic quadrangle maps","","Title, authors, year, scale, reference information, total number of pages (if report accompanies map), file size","USGS national geologic map database will be checked.  Team will seek permission from state geological survey to place their geological maps online for free download.  Where permission is granted, existing scanned 1:24,000 geologic maps and their accompanying reports will be converted to .pdf and made available for free download on VA DMME server.  Paper maps not currently available digitally for which permission is granted will be scanned, converted to pdf, and placed online for free download.  ",35,map
338,"Geologic Unit feature,  geothermal characterization",Descriptions of geologic units mapped in the state,300,"Rock unit name, major lithologies, thermal conductivity","Geologic rock units used on geologic maps in the state will be described and characterized, including thermal conductivity data, where available.  Records will be stored in web-accessible database on VA DMME* server.  ",35,meta
339,Hot spring description,Springs with higher-than-background water temperature,28,"Latitude, longitude, flow rate, water temperature, water chemistry (if available)","Descriptions of every thermal spring in the state will be gleaned from published and unpublished reports.  Data will be checked against existing online databases (e.g., SMU) to eliminate duplication.  Currently unavailable data will be stored in web-accessible database on VA DMME server.  ",35,temp
340,Bottom hole temperature,Bottom-hole temperatures from water wells and oil and gas wells,300,"Latitude, longitude, well identification information, depth/elevation, bottom-hole temperature, time lapsed since circulation stopped ","Wells with available bottom-hole temperature data currently unavailable through other sources (e.g., SMU) will be identified and a representative set of data from around the state will be selected for entry into a web-accessible database on a VA DMME server.  ",35,temp
341,Heat flow measurement ,Direct heat flow measurements from geothermal test wells.  Virginia Tech data.,77,"Latitude, longitude, well identification information, depth/elevation, measured heat flow","For wells currently unavailable through other sources (e.g., SMU), heat flow measurements will be entered in web-accessible database on VA DMME server.  ",35,temp
342,Thermal conductivity measurement ,Thermal conductivity of rocks tested by Virginia Tech,100,"Latitude, longitude, sample identification information, depth/elevation of sample, measured thermal conductivity, measurement procedure","For wells currently unavailable through other sources (e.g., SMU), thermal conductivity measurements will be gleaned from published and unpublished reports.  Data will be stored in web-accessible database on VA DMME server.  ",35,temp
343,Borehole features ,borehole digital data,"96,000","96,000 Water Wells  - Digital database in ---- format",Metadata and Link to live on-line data hosted at the Vermont Agency of Natural Resources (Vt ANR); static data may be delivered as ESRI shape file to NGDS for data repository. ,10,temp
344,Document,Vermont Geological Survey Publications: Reports with associated geologic maps,165,"","Metadata created; Reports scanned and delivered as pdf files to NGDS repository, maps as high resolution tiff and georectified; georectified tiffs sent to NGDS; on-line links to existing low res jpg and/or pdf files hosted at VT ANR.",10,meta
345,"Bedrock, Surficial and Hydrogeologic Maps",Digital (shapefiles and geodatabase files) ,"","43 Digital geologic map publications; 19 personal geodatabases, 76 shapefiles  ",Data is posted on-line at the Vermont Geological Survey/Vermont Center for GeoInfo. Maps are in the NGMDB. Link will be provided for digital data and for on-line images.,10,map
346,Document ,"Misc published/unpublished documents: Vermont Geology, Town sand and gravel resource reports, newspaper articles, technical reports",1050,"","Reports and maps will be scanned and delivered to NGDS document repository as pdf files, metadata will include bibliographic reference plus location name (town, county or quadrangle) and key words. ",10,meta
347,Document ,Natural Gas Exploration Well Archives,6,"","Exploration well logs, descriptions and reports will be scanned and delivered to NGDS document repository as pdf files; wells will have lat/long location. ",10,meta
348,Document,Non-VGS publications,1800,"","Metadata/bibliographic reference in excel spreadsheet with on-line link to source of publication, location information listed by town, county or quadrangle.",10,meta
349,Document,Masters degree theses,40,"","Reports and maps will be scanned and delivered as pdf files, metadata will include bibliographic reference plus location name (town, county or quadrangle) and key words. ",10,meta
350,Document,Document  and metadata,1,Mineral Resource Database,Links to Vermont Center for Geographic information and United State Geological Survey web site,10,meta
351,Document,Metallic and Non-metallic mineral  and site information,200,"","Reports and maps will be scanned and delivered as pdf files, metadata will include bibliographic reference plus location name (town, county or quadrangle) and key words. ",10,meta
352,Borehole lithology log dataset,600 O&G well locations ; 150 geot;  1000 Water well records w/temp data. Select water well logs with temperature; select oil and gas well logs and temperatures; geothermal well logs; ,833 total ,"Lithology; temperature, depth, borehole ID, collar elevation, lat, long of collar, source, date,  hole diameter, procedure",Link to Ecology online interactive database for water wells; submit to NGDS; enter key oil and gas well data and scan appropriate lithology logs for oil and gas; same for geothermal logs and submit to NGDS. Place well locations and logs on Washington Geologic Information Portal which uses ArcGIS Server. This site has Web Feature Service (WFS) and Web Map Services (WMS) capabilities . ,2,lith
353,Borehole lithology log dataset,Lithology logs,80,"Lithology; depth, borehole ID, collar elevation, lat, long of collar, source, date, hole diameter, procedure used","Link to geotechnical borings that are in a database and scanned; submit to NGDS;  Submit to NGDS and place on Washington Geologic Information Portal interactive site, which uses ArcGIS Server. This site has Web Feature Service (WFS) and Web Map Services (WMS) capabilities . ",2,lith
354,Temperature depth log,Records will  be examined Temperature log profiles from bore holes,422 records ,"Temperature, depth, borehole ID, collar elevation, lat., long. of collar, source, date, settling interval, hole diameter, procedure; Temp-depth profiles; ","Data in an excel spreadsheet ; borehole temperature WFS service or place on Washington Geologic Information Portal, which uses ArcGIS Server. This site has Web Feature Service (WFS) and Web Map Services (WMS) capabilities . ",2,lith
355,Document,All reports produced by Washington Geological Survey on geology and geothermal topics; Also includes  a update to our geothermal bibliography of WA; ,1000 scanned publications ,Scan documents and then Optical Character Recognition (OCR) to make searchable.,Submit all 1000 scanned documents to NGDS in year 1.  We will place all 1000 scanned documents online on WGS web site. ,2,meta
356,Geologic map,Geologic maps at 1:500k; 1:250k; 1:100k ; 1:24k,55 individual maps ,"Lithology, Formation, age, faults, folds, point data, labels ","1:500k; 1:250k; 1:100k state wide and some 1:24k coverage is already digital and can be submitted to NGDS; 5 priority 1:24k maps will be submitted to NGDS. Place data on WGS Washington Geologic Information Portal interactive site, which is our WFS.",2,map
357,Geothermal map,1981;1994; 2008 maps; Idaho National Lab map which is based on WGS map,4 maps,"Location, temperatures, with shaded polygons indicating high and low temp geothermal areas.","Data will be digitized from the most recent and complete map and  provided in a shape file for NGDS document repository; Data will be placed on WGS web site and on Washington Geologic Information Portal interactive, which uses ArcGIS Server. This site has Web Feature Service (WFS) and Web Map Services (WMS) capabilities.",2,meta
358,Active fault,Line features and descriptions for  active faults;,200,"Age of last movement, fault type, estimated total displacement, slip vector, reference","Taken from existing database or data and will be digitized from geologic maps and imagery, and  provided in an  shape file for NGDS document repository; Data will be placed on WGS web site and/or on Washington Geologic Information Portal interactive site.",2,tect
359,"Geologic unit feature,  geothermal characterization",Lithology intervals,"","Unit descriptions, lithology; occasional permeability and porosity, thermal conductivity and specific heat.","Taken from existing database, publications, or data will be digitized from geologic maps , and  provided in a shape file for NGDS document repository; Data will be placed on WGS web site and/or on Washington Geologic Information Portal interactive site which uses ArcGIS Server. This site has Web Feature Service (WFS) and Web Map Services (WMS) capabilities. Only selected digitizing of 1:24k will be done, otherwise will exceed the time allotted.",2,meta
360,Volcanic vent feature,Volcanic vents dataset,300,"Location of vents, lithology, age","Data will be provided in an excel spreadsheet document, in a feature class and shape file and shape file for NGDS repository; Data will be placed on WGS web site and on Washington Geologic Information Portal which uses ArcGIS Server. This site has Web Feature Service (WFS) and Web Map Services (WMS) capabilities .  ",2,tect
361,Bottom hole temperature, holes around Washington  from data loggers placed in water wells.,100,"Location of boreholes, depth, depth of temperature, date",Data will be provided in an excel spreadsheet document and in a feature class and shape file for NGDS repository; Data will be placed on WGS web site and on Washington Geologic Information Portal  ,2,temp
362,Earthquake epicenter/hypocenter,Locations of earthquake epicenters and hypocenters,300,"Time, magnitude, location of hypocenters to define active areas. Propose to exclude data below magnitude 2.5 ",Data will be provided in an excel spreadsheet document and feature class and shape file for NGDS repository; Data will be placed on WGS web site and on Washington Geologic Information Portal which uses ArcGIS Server. This site has Web Feature Service (WFS) and Web Map Services (WMS) capabilities.,2,tect
363,Temperature,bottom hole temperature,100,"Temperature, depth, borehole ID, collar elevation, lat, long of collar, source, date measured,  hole diameter, procedure; Temperature depth profiles;","Data will be provided in an excel spreadsheet document, feature class and shape file for NGDS repository; arrangement with NGDS to incorporate data into database for NGDS borehole temperature. Place on Washington Geologic Information Portal which uses ArcGIS Server. This site has Web Feature Service (WFS) and Web Map Services (WMS) capabilities.",2,temp
364,Borehole lithology log dataset,wells w/temperature logs,200,"depth, borehole ID, lat, long, elevation, lithology, stratigraphy, hole diameter, date drilled, casing","Data will be provided in standard schema, WGNHS to host OGC service of logs locations.",8,lith
365,Digital well log,digital well logs,200,"depth, borehole ID, lat, long, elevation, natural gamma, normal resistivity, self potential, caliper, temperature, fluid conductivity, borehole flow.","Data will be made available in LAS format for repository, WGNHS to host WFS.",8,lith
366,Document,Wisconsin Geological and Natural History Survey (WGNHS) publications,2,Wisconsin Geological and Natural History Survey publication.  These Bulletins give the geology of the granites in central Wisconsin,"Scanned images of the publications in PDF format will be made available for repository, WGNHS to host WMS for map data.",8,meta
367,Bottom hole temperature,bottom hole temperatures,200,"depth, borehole ID, lat, long, elevation, lithology, stratigraphy, temperature","Observation data will be provided in standard schema, WGNHS to host OGC service.",8,temp
368,Crustal Stress data,"values from literature (Haimson,1980 for example)",5,"lat, lon, max and min stresses, depth, orientation, method","Observation data will be provided in standard schema, WGNHS to host OGC service.",8,tect
