1,Hot spring description,multiple features for each hot spring site,> 111,"Descriptions of 111 thermal springs and wells statewide includes location, physiography, water chemistry (some sites), flow rate (some sites), and detailed description of site.","Data currently exists as unpublished data and notes and a smaller subset of published data in scanned PDF format for 111 Alaska thermal hot springs. Compile this available Alaska hot spring data in all formats (published and unpublished). Develop Excel spreadsheet format in accordance with to-be-established NGDS format to record information for each hot spring, that will include location (in elevation, lat long format), physiography, water chemistry (some sites), flow rate (some sites), and detailed description of site. Generate ArcGIS polygon and point coverages for entire data set with appropriate georeferenced map coverages. Submit entire data set with associated metadata in Excel document and  ArcGIS shape files to NGDS repository. Publish to DGGS website.",51,temp
2,Bottom hole temperature, corrected bottom hole temperature; accompanying metadata.,3048,"Well ID; elevation, lat, long of well collar; depth; date, time and type of measurement.",Create corrected BHT dataset in Excel spreadsheet format in accordance with to-be-established NGDS format. Create ArcGIS point coverages for data set with appropriate map coverages. Submit data set with associated metadata in Excel document to NGDS repository. Publish to DGGS website.,51,temp
3,Metadata,"Data records for inclusion into the NGDS, metadata will be created that conforms to the NGDS format.",> 3159,"",Metadata records will be created in table form or xml file for each data point (Hot spring and BHT) for import into NGDS catalog server. Details will be coordinated with NGDS project management. Appropriate documents for each record will be scanned and placed in web-accessible location on appropriate website (DGGS or NGDS repository); URLs will be in metadata.,51,meta
4,Development of GIS Databases and Metadata,dataset documents and corresponding metadata records,4,Basic GIS databases and metadata attributes required to support core databases developed under items 6 through 9,"Create metadata records for datasets using USGIN metadata wizard; place documents containing datasets (mdb, xls, shp) in repository.",43,meta
5,Formation Temperatures,"Well header data, geophysical temperature observations",1000 new wells; 1500 legacy data,"Well descriptors, such as bore hole name, permit number, location coordinates, surface elevation, as well as measured parameters like temperature, depth, formation, borehole diameter, fluid type, information source",Excel spreadsheet and metadata record for dataset created using USGIN metadata wizard,43,temp
6,Geochemical data,chemical analysis records for borehole fluid,100 CBM Wells; 332 analysis records from Brine wells              ,"Location, depth, physical and aggregate properties, major ionic compounds, metals, trace elements.",Excel spreadsheet and metadata record for dataset created using USGIN metadata wizard,43,wchem
7,Fault information ,active fault records,50,"Fault type, estimated total displacement, slip vector, and juxtaposed stratigraphic units, depth, source of information; date of earthquake, county, nearest town, lat/long, depth, magnitude, description, source of information","Arc GIS shapefile, Excel spreadsheet, and metadata record for dataset created using USGIN metadata wizard.",43,tect
8,Earthquake epicenter,earthquake epicenter record,250,"","",43,tect
9,Core analysis data ,physical property records,100,"Location, porosity, permeability, fluid saturation data.",Excel spreadsheet and metadata record for dataset created using USGIN metadata wizard,43,lith
10,References,metadata records,At least 3,"Author, publication date, title, publisher, pages.  Metadata content as per project recommendations.",Metadata in excel spreadsheet.,43,meta
11,Borehole lithology log dataset,Lithologic logs for selective wells to serve as formational analogs. Data will be in .xls file format. ,480,480 digital borehole lithologic log records for select boreholes that will serve as formational analogs.,Digital data files will be provided in an excel spreadsheet and/ or MS Access document.,47,lith
12,Digital well log,Digital Well Logs in LAS file formats,100,100 digital well log records for select boreholes that will serve as formational analogs.   ,Digital well log data  provided in an LAS file format. ,47,lith
13,Temperature depth log,Temperature logs will take priority over BHT E-logs and will be digitized into LAS formats.,25,25 digital temperature depth log records for select boreholes and wells that will serve as formational analogs for temperature gradient.   ,Digital data in an excel spreadsheet and /or MS Access file formats. Supporting well log .pdf image files for NGDS repository. ,47,lith
14,Document,"AGS publications containing lithologic information, stratigraphic information, and historical borehole analogs will be in .pdf format.",3,"3 documents containing well-data related to depth, lithology, significant formation, temperatures, etc. Maps of focal areas of interest. ",Digital documents will be provided in .pdf file formats.,47,meta
15,Active Fault Map,Known active fault maps of statewide coverage. Records will be in shape file format or geotifs.,4,4 maps of the active fault areas that would provide statewide coverage for Arkansas.,Digital  files in a shape file format. Supporting active fault maps will be provided in .pdf format. ,47,tect
16,Bottom hole temperature,"E-logs (SP, Res, Gamma, etc.) with BHT recordings.",250,"Scan, and process information for 250 .pdf image files of E-Logs for specific boreholes. ",Digital data in an excel spreadsheet and/ or MS Access file format. Supporting well log .pdf image files.,47,temp
17,Earthquake epicenter,areal and point locations for earthquake epicenters in shape file formats and .xls file formats.,100 plus,100 plus records,Digital shape files will be provided in an excel spreadsheet and/ or MS access file formats. Supporting earthquake epicenter maps as geotiff image files ,47,tect
18,Temperature,Water temperature  data records will be digitized and stratified into tabular data (.xls) format.  ,250,"250 temperature recordings of the 7,000 water temperature records we have available.",Digital data files will be provided in an excel spreadsheet and/or MS Access file formats.  ,47,temp
19,"Trace constituent chemistry dataset. (Water Chemistry, trace-element data)",Water geochemistry data in tabular data files .xls and /or MS Access.,100,Trace constituent chemistry records for 100 different boreholes/ sources. ,Digital data files  in an excel spreadsheet and / or MS Access file formats. Supporting well log .pdf image files ,47,wchem
20,Active faults,Active faults as feature lines,50 faults,line feature ,line feature WFS,37,tect
21,Hot spring descriptions,Data pertaining to about 45 thermal springs (temp. > 20 C) in Arizona,45,Hot springs data for basic feature items,Data will be provided in an MS Excel spreadsheet document for NGDS repository; arrangement with NGDS core to incorporate data into database for NGDS borehole temperature WFS service.,37,temp
22,Hot Springs Water Chemistry,Thermla well  fluid chemistry ,35,"general chemistry, isotopes, field parameters.",Set up as WFS and register document with Excel spreadsheet,37,wchem
23,Documents,documents,740,"produce metadata, scan documents",Put pdf online in repository,37,meta
24,References,List of references on geothermal papers/reports,1,document,Adobe Pdf document ,37,meta
25,Bottom hole temperatures,well data from logs with tempertaures,1140,"well name, location, temperature","Set up as observation feature service, and register document with Excel spreadsheet",37,temp
26,Lithologic logs,"Lithologic logs of temperature-depth boreholes to accompany ""Temperature-depth logs"" in previous data item.",about 9,"lithology, interval",Prepare a report containing temperature-depth data from previous data item and include graphic lithologic logs (where available) to accompany the spreadsheet in the previous data item.,37,lith
27,Drill stem tests,Drill-stem test data from wells drilled for oil & gas in Arizona.,about 150,"DTS test data, location, pressures, intervals","DST data to be provided in MS Excel spreadsheet(s), GIS layers, and documents for NGDS repository.  First year contribution out of about 585 total DSTs.",37,wchem
28,Water chemistry dataset.,Thermla well  fluid chemistry ,2213 analyses,"general chemistry, isotopes, field parameters.","Set up as observation feature service, and register document with Excel spreadsheet",37,wchem
29,Thermal well descriptions,"Borehole data inlcuding borehole ID, name, lat/long, temp, driller data. ",200,Data pertaining to about 200 thermal wells (temp. > 20 C) in Arizona,Data will be provided in an MS Excel spreadsheet document for NGDS repository; arrangement with NGDS core to incorporate data into database for NGDS borehole temperature WFS service. First year contribution out of about 1200 total thermal wells.,37,temp
30,Temperature-depth logs,Borehole data,about 38,"borehole ID, name, lat/long, temp, driller data. ",Would make additional temperature-depth data available as MS Excel spreadsheet(s) for NGDS and SMU,37,temp
31,Temperature-depth profiles,Boreholes with temperature-depth profiles ,about 113,"borehole ID, name, lat/long, temp, driller, temp, depth ",Would make additional temperature-depth data available as MS Excel spreadsheet(s) for NGDS and SMU,37,temp
32,Volcanic vents,Volcanic vents ,24,"age, location, type, geologic unit","Volcanic vents data to be provided in MS Excel spreadsheet(s), GIS layers, and documents for NGDS repository.  Additional Year-1  data.",37,tect
33,State Map with Goethermal Data,document metadata,1,299 springs listed on 1 map,WFS and WMS with features observation. Note: Map only available for purchase.,25,map
34,Hot Springs,Data pertaining to about 304 thermal springs (temp. > 20 C),304,304 springs listed on report,WFS with features observation,25,temp
35,Hot Springs ,Data pertaining to about 990 thermal springs (temp. > 20 C),990,CAGS database - 990 hot springs locations,Document - database in Excel,25,temp
36,Documents relating to geothermal,CGS OFRs on geothermal research . Provide metadata in template.,11,11 Scanned documents and references catalogued,provide CGS  metadata ,25,meta
37,Hot Springs Fluid Chem,Thermla well  fluid chemistry,212,"general chemistry, isotopes, field parameters.",WFS and WMS with features observation,25,wchem
38,active volcanic vents,Volcanic vents ,1,"age, location, type, geologic unit",Provide CSSC link metadata,25,tect
39,geothermal energy production documents,CGS geothermal energy production bulletins . Provide metadata in template.,20,20,Provide CSG link metadata,25,meta
40,Metadata  (Bottom Hole Temperature),document metadata,1,989 Geothermal wells from GHC document,Provide link metadata to CGS Open file report order catalogue,25,meta
41,active faults,Active faults as feature lines,222,222,WMS based on new active fault database,25,tect
42,Temperature gradients for many of the sedimentary basins,document metadata,1,Document,"Paper by Sanyal, Robertson-Tait, Kraemer, and Buening (Sanyal, S.K., Robertson-Tait, A., Kraemer, M., and Buening, N., 1993, A survey of potential Geopressured Resource Areas in California, Proceedings Eighteenth Workshop on Geothermal Engineering, Stanford University, Stanford California, January 26-28, 1993.",25,temp
43, Borelogs - Oil and Gas,"Borehole data inlcuding borehole ID, name, lat/long, temp, driller data. ",3064,"CA wells database: 198,367 O&G wells",Database in Access/Excel file; Provide metadata for link to DOGGR (preferred) or  data to Hub server,25,lith
44,injection wells - Oil and Gas,"Borehole data inlcuding borehole ID, name, lat/long, temp, driller data. ",1,Removed from deliverbales,"database in MS Access, provide CGS  metadata  or  data to Hub service",25,lith
45,Geothermal well s BHT Temperature ,"Borehole data inlcuding borehole ID, name, lat/long, temp, driller data. ",1,"147,131 data, non-confidential",databases in MS Access - provide DOGGR  metadata  or  data to Hub service,25,temp
46,Status - Idle Wells - O&G  wells,"Borehole data inlcuding borehole ID, name, lat/long, temp, driller data. ",19558,"1 database containing 19,958 wells currently idle in all 6 districts in CA ",Provide metadata for DOGGR link to Idle Well website,25,temp
47,Document - Bibliography,Bibliography for Colorado geothermal,1,document,Initial searchable text file will be on-line in 2010.  Host for online access will be CGS server.  Interchange format not applicable (?).   ,32,meta
48,Document - References,List of geothermal references unique to Colorado,250,document,Initial spreadsheet will be on-line on 2010.  Host will be CGS server.  Downloadable copies of all documents without copyright will be added in a subsequent SOW.,32,meta
49,Bottom hole temperature - maps,Published (2010) geothermal maps of Colorado based primarily on BHT data,2,"476 MB (O&G Geothermal)226 MB (Geothermal Gradient)",These map products are currently available as CD-ROMs.  All that remains is to load them onto the CGS server in a form in which they may be downloaded.  ,32,map
50,Bottom hole temperature - Corrections,Documentation for corrections for BHT data,6,"",Document will be on-line as a PDF file in 2010.  Host for online access will be CGS server.  Interchange format not applicable (?).,32,temp
51,Bottom hole temperature - data,BHT data from O&G wells with drilling disturbance corrections,">10,000","",Data will be spreadsheets organized by Basin or Field with files placed on-line in 2010. ,32,temp
52,Hot Spring Description - basic information,Warm and Hot Spring basic parameters,>110,"","Data will be in a spreadsheet organized alphabetically by the main name of the spring location, with file on-line in 2010.  Host for online access will be CGS server.  ",32,temp
53,Hot Spring Description - geochemistry,Chemical analyses of water from warm and hot springs,110,"","Data will be in a spreadsheet organized alphabetically by the main name of the spring location, with main files on-line in 2011.  Include spring name,  temperature, chemical composition as defined by basic groundwater chemical analysis typical for geothermal studies.   ",32,wchem
54,Hot Spring Description - geothermometry from spring data,Geothermal reservoir temperature estimates based chemical and isotopic data,60-70 ,"","Data will be in a spreadsheet organized alphabetically by the main name of the spring location, with files on-line in 2011.  Include spring name, temperature, estimated reservoir temperatures from various silica, cation, and, where available, isotopic geothermometers.  ",32,temp
55,Heat flow measurement - map,Published (2008) geothermal maps of Colorado based primarily on heat-flow data,1,298 MB,This map product is currently available as a CD-ROM.  All that remains is to load it onto the CGS server in a form in which it may be downloaded.  It is likely to be updated during the  project.,32,temp
56,Geologic map - Part 1,Digital Geologicla map,1,"Colorado geologic map (1:500,000) ArcGIS data - 25 MB","Colorado geologic map (1:500,000) ArcGIS data is available on the internet via USGS (http://pubs.usgs.gov/of/1992/ofr-92-0507/).  CGS also has the digital data.  CGS will expose to NGDS, as WMS/WFS using existing attributes on map.   ",29,map
57,Active Fault,Active faults as feature lines,1,Active fault content model and shapefiles - 20 MB,"""Expose"" data to the NGDS in the recommended formats.  Data portal page: http://geosurvey.state.co.us/Default.aspx?tabid=270 Data hosting page: http://165.127.23.67/cgsmap/LoadMap.cfm Currently on-line",32,tect
58,Chemical analysis (whole-rock chemistry)/observation,point features as records in a shape file,120,"Lat and Long of sample location, elevation of sample, sample type, rock type, density, Si02, TiO2, Al2O3, Fe2O3, MnO, MgO, CaO, Na2O, K2O, P2O5, Loss on Ignition ",Data will be provided as an ESRI shape file for NGDS document repository; arrangement with local hub (Kentucky) to host WFS; NGDS-compliant metadata,19,rchem
59,Trace constituent chemistry data,point features as records in a shape file,120,"Lat and Long of sample location, elevation of sample, sample type, rock type, density, Nb, Zr, Sr, Y, Rb, U, Th, Pb, Zn, Ni, Cr, Ga, V, Ce, Ba, La ",Data will be provided as an ESRI shape file for NGDS document repository; arrangement with local hub (Kentucky) to host WFS; NGDS-compliant metadata,19,wchem
60,Lithologic Logs ,lithologic logs of deep boreholes (5 separate items totalling 439 pages),5,"Borehole identifier, locational coordinates, box#, interval (ft)",pdf file to be provided for each lithologic log for NGDS document repository.,19,lith
61,Aeromagnetic Map ,Aeromagnetic Map of Connecticut,1,"magnetic countours, ci = 50 gammas",georeferenced tiff to be provided for NGDS document repository; arrangement with local hub (Kentucky) to host WFS; NGDS-compliant metadata,19,map
62,Aeroradioactivity Map ,"Aeroradioactivity and Generalized Geologic Maps of Parts of CT,RI and MA (USGS GP 359)",1,radioactivity as cps gross gamma,georeferenced tiff to be provided for NGDS document repository; arrangement with local hub (Kentucky) to host WFS; NGDS-compliant metadata,19,map
63,Aeroradioactivity Map ,Aeroradioactivity of parts of East Central NY and West-Central NewEngland(USGS GP 358),1,radioactivity as cps gross gamma,georeferenced tiff to be provided for NGDS document repository; arrangement with local hub (Kentucky) to host WFS; NGDS-compliant metadata,19,map
64,"Borehole lithology logs, geothermal test wells",Lithologic descriptions of cuttings or core by depth interval,5,"Latitude, longitude, elevation, well identification information, completion date, depth intervals, lithology for interval","For wells currently unavailable through other sources (e.g., SMU), interval lithology descriptions will be entered in web-accessible database on VA DMME server.  ",29,lith
65,"Borehole lithology logs, water wells",Lithologic descriptions of cuttings or core by depth interval,200,"Latitude, longitude, elevation, well identification information, completion date, depth intervals, lithology for interval",For wells  interval lithology descriptions will be entered in web-accessible database on VA DMME server. Representative wells from around the state will be selected.  ,29,lith
66,Bottom hole temperature,Bottom-hole temperatures from water wells ,100,"Latitude, longitude, well identification information, depth/elevation, bottom-hole temperature, time lapsed since circulation stopped ",Wells with available BHTdata will be identified and a representative set of data from around the state will be selected for entry into a web-accessible database on a VA DMME server.  ,29,temp
67,"Digital well log, geothermal test wells ",Paper geophysical logs to be scanned,5,"Latitude, longitude, elevation, well identification information","For wells  paper geophysical logs will be scanned.  For wells with digital logs available in-state but off-line, files will be acquired, verified, and quality-checked.  Files will be placed on publicly-accessible directory on VA DMME server.  ",29,lith
68,"Digital well log, water wells ",Paper geophysical logs to be scanned,100,"Latitude, longitude, elevation, well identification information","For wells  paper geophysical logs will be scanned.  For wells with digital logs available in-state but off-line, files will be acquired, verified, and quality-checked.   Representative wells from around the state will be selected.  ",29,lith
69,Document,"Various published and unpublished reports emanating from geothermal research at Virginia Tech, 1969-1989",30,"Title, authors, year, reference information, page numbers, total number of pages, file size",Bibliography of published and unpublished documents related to geothermal energy in the state will be developed and placed on VA DMME server.  ,29,meta
70,Geologic map,Modern and historical paper geologic maps at various scales.7 geologic maps are available as digital polygons; five are available as georeferenced TIFF images; various scales.,15,"Title, authors, year, scale, reference information, total number of pages (if report accompanies map), file size","Team will seek permission from state geological survey to place their geological maps online for free download.  Where permission is granted, existing scanned 1:24,000 geologic maps and their accompanying reports will be converted to .pdf and made available for free download on VA DMME server.  Paper maps not currently available digitally for which permission is granted will be scanned, converted to pdf, and placed online for free download.  ",29,map
71,"Geologic Unit feature,  geothermal characterization",Descriptions of geologic units mapped in the state,50,"Rock unit name, major lithologies, thermal conductivity","Geologic rock units used on geologic maps in the state will be described and characterized, including thermal conductivity data, where available. ",29,meta
72,Heat flow measurement ,Direct heat flow measurements from geothermal test wells.  Virginia Tech data.,5,"Latitude, longitude, well identification information, depth/elevation, measured heat flow",For wells heat flow measurements will be entered in web-accessible database on VA DMME server.  ,29,temp
73,Hot spring description,Hot spring description,TBD,Descriptions of thermal springs in the state  from published and unpublished reports.  ,"",29,temp
74,Temperature depth log ,Temperature logs from geothermal test wells,5,"Latitude, longitude, well identification information, depth/elevation, temperature ","For wells currently unavailable through other sources (e.g., SMU), temperature/depth measurements will be entered in web-accessible database on VA DMME server.  Metadata will be developed for all records and entered into NGDS.",29,lith
75,Thermal conductivity measurement ,Thermal conductivity of rocks tested by Virginia Tech,TBD,"Latitude, longitude, sample identification information, depth/elevation of sample, measured thermal conductivity, measurement procedure","For wells , thermal conductivity measurements from published and unpublished reports.  ",29,temp
76,Document-Temperature log,pdf of scanned log. document (scanned log),>10,Document metadata for scanne dlogs,metadata record in catalog,49,meta
77,Hot springs,hot spring description,2,"name, locaiton, temperature",Excel spreadsheet,49,temp
78,Meta data ,"Statewide temperature database and for Oil and Gas Database - Borehole feature descriptions, BHT",2,"Oil & gas data base. The ""amount"" can only be described by the number of wells in the data base. There are injection wells and disposal wells for which  data and metadata are avialble. All of this data is digitized. Also digitized are the bottom hole temp",Metadata for statewide temperature database and for Oil and Gas Database.,49,meta
79,Temperatue log,temperature log coverage record. Borehole temperature coverage (LAS files?),>10,LAS document,"data set of {temperature, depth} tuples, BoreholeID, procedure, date measured, time since circulation",49,temp
80,Oil & gas data base  bottom hole temperatures,metadata records for O&G boreholes. Bottom hole temperature data,1000,"BHT dataset name, location, tempertaure",Same as above,49,lith
81,Borehole data,"Class I domestic and Industerial wells 190, monitoring wells  about 350 wells. Class V 102 wells. Class V non ASR wells about 50,000 . metadata for UIC database, borehole feature descriptions. UIC data base that resides in the State's DEPclasses I, II, IV","56,500","The amount and qulaity of metadata will be evaluated along with evaluating the utility of the UIC data base for the geothermal project. Class I domestic and Industerial wells 190, each well is associated with one or two monitoring wells numbering about 35",Data will be delivered in digital format,49,lith
82,Borheole data - artesian wells,"metadata record for each district. water source feature descriptions, metadata for what the WMDs have that is geothermally relevant.",5,unknown. Those are abandoned or partially abandoned exploration wells that are the responsibility of the 5 WMDs. We have only sketchy information about the status of these wells and the nature or quality of data collected by the 5 districts; thus their ut,"metadata describing resources maintained by district; Ideally metadata records for each resource or resource type in the stewardship of each district would be produced, enumerating number of items, kind of data, contact information. Better yet, a feature service with information from each well.",49,meta
83,"Borehole lithology logs, geothermal test wells",Lithologic descriptions of cuttings or core by depth interval,27,"Latitude, longitude, elevation, well identification information, completion date, depth intervals, lithology for interval",For wells interval lithology descriptions will be entered in web-accessible database on VA DMME server.  ,45,lith
84,"Borehole lithology logs, water wells",Lithologic descriptions of cuttings or core by depth interval,100,"Latitude, longitude, elevation, well identification information, completion date, depth intervals, lithology for interval",For wells interval lithology descriptions will be entered in web-accessible database on VA DMME server. Representative wells from around the state will be selected.  ,45,lith
